<?xml version="1.0" encoding="UTF-8"?>
<!-- ex03-6 XML -->
<PRODUCTDATA xmlns:xsi="http://www.w3.org/2001/XMLSchema-instance" xsi:noNamespaceSchemaLocation="product.xsd">
    <PRODUCT>
        <PRODUCTNAME>hello</PRODUCTNAME>
        <DESCRIPTION>nice</DESCRIPTION>
        <PRICE>100.0</PRICE>
        <PRICE>200.59</PRICE>
        <PRICE>23.9994</PRICE>
        <QUANTITY>194</QUANTITY>
    </PRODUCT>
</PRODUCTDATA>